{
  "$schema": "https://json-schema.org/draft/2020-12/schema",
  "$id": "https://secure-bench.invalid/schemas/phase27-review-v2.schema.json",
  "type": "object",
  "additionalProperties": false,
  "required": ["schema_version", "status", "reviewed_pairs", "reviewed_cases", "vulnerable_path_reviews", "control_semantic_reviews", "authorization_control_reviews", "exact_unique", "normalized_unique", "balance_verified", "case_executions", "scanner_executions"],
  "properties": {
    "schema_version": {"const": "secure-bench-phase27-neutral-review-v2"},
    "status": {"const": "passed-before-freeze"},
    "reviewed_pairs": {"const": 56},
    "reviewed_cases": {"const": 112},
    "vulnerable_path_reviews": {"const": 56},
    "control_semantic_reviews": {"const": 56},
    "authorization_control_reviews": {"const": 8},
    "exact_unique": {"const": 112},
    "normalized_unique": {"const": 112},
    "balance_verified": {"const": true},
    "case_executions": {"const": 0},
    "scanner_executions": {"const": 0}
  }
}
