{
  "authorization_control_reviews": 8,
  "balance_verified": true,
  "case_executions": 0,
  "control_semantic_reviews": 56,
  "exact_unique": 112,
  "normalized_unique": 112,
  "reviewed_cases": 112,
  "reviewed_pairs": 56,
  "scanner_executions": 0,
  "schema_version": "secure-bench-phase27-neutral-review-v2",
  "status": "passed-before-freeze",
  "vulnerable_path_reviews": 56
}
